{
  "$schema": "https://json-schema.org/draft/2020-12/schema",
  "title": "T2M monthly point-series profile v0.1.0",
  "type": "object",
  "additionalProperties": false,
  "required": [
    "schema_version",
    "output_type",
    "module",
    "region",
    "spatial_support",
    "variable",
    "time",
    "provenance",
    "quality",
    "series",
    "module_details",
    "method"
  ],
  "properties": {
    "schema_version": {
      "const": "0.1.0"
    },
    "output_type": {
      "const": "monthly_point_series"
    },
    "module": {
      "type": "object",
      "additionalProperties": false,
      "required": [
        "id",
        "version"
      ],
      "properties": {
        "id": {
          "const": "air_temperature_2m"
        },
        "version": {
          "type": "string",
          "pattern": "^\\d+\\.\\d+\\.\\d+$"
        }
      }
    },
    "region": {
      "type": "object",
      "additionalProperties": false,
      "required": [
        "id",
        "label",
        "selection_status",
        "candidate_bbox",
        "candidate_window_version"
      ],
      "properties": {
        "id": {
          "type": "string",
          "minLength": 1
        },
        "label": {
          "type": "string",
          "minLength": 1
        },
        "selection_status": {
          "const": "candidate"
        },
        "candidate_bbox": {
          "type": "array",
          "items": {
            "type": "number"
          },
          "minItems": 4,
          "maxItems": 4
        },
        "candidate_window_version": {
          "type": "string",
          "minLength": 1
        }
      }
    },
    "spatial_support": {
      "type": "object",
      "additionalProperties": false,
      "required": [
        "kind",
        "longitude",
        "latitude"
      ],
      "properties": {
        "kind": {
          "const": "point_sample"
        },
        "longitude": {
          "type": "number",
          "minimum": -180,
          "maximum": 180
        },
        "latitude": {
          "type": "number",
          "minimum": -90,
          "maximum": 90
        }
      }
    },
    "variable": {
      "type": "object",
      "additionalProperties": false,
      "required": [
        "id",
        "unit",
        "height_m"
      ],
      "properties": {
        "id": {
          "const": "air_temperature_2m"
        },
        "unit": {
          "const": "degC"
        },
        "height_m": {
          "const": 2
        }
      }
    },
    "time": {
      "type": "object",
      "additionalProperties": false,
      "required": [
        "frequency",
        "start",
        "end",
        "calendar",
        "provider_time_standard"
      ],
      "properties": {
        "frequency": {
          "const": "monthly"
        },
        "start": {
          "type": "string",
          "pattern": "^\\d{4}-(0[1-9]|1[0-2])$"
        },
        "end": {
          "type": "string",
          "pattern": "^\\d{4}-(0[1-9]|1[0-2])$"
        },
        "calendar": {
          "const": "gregorian"
        },
        "provider_time_standard": {
          "enum": [
            "LST",
            "UTC"
          ]
        }
      }
    },
    "provenance": {
      "type": "object",
      "additionalProperties": false,
      "required": [
        "provider",
        "product",
        "api_version",
        "sources",
        "request_url",
        "retrieved_at",
        "response_sha256"
      ],
      "properties": {
        "provider": {
          "const": "NASA POWER"
        },
        "product": {
          "const": "POWER Monthly and Annual API"
        },
        "api_version": {
          "type": "string",
          "minLength": 1
        },
        "sources": {
          "type": "array",
          "items": {
            "type": "string",
            "minLength": 1
          },
          "minItems": 1
        },
        "request_url": {
          "type": "string",
          "format": "uri",
          "pattern": "^https://power\\.larc\\.nasa\\.gov/api/temporal/monthly/point\\?"
        },
        "retrieved_at": {
          "type": "string",
          "format": "date-time",
          "pattern": "^\\d{4}-\\d{2}-\\d{2}T\\d{2}:\\d{2}:\\d{2}(?:\\.\\d+)?(?:Z|[+-]\\d{2}:\\d{2})$"
        },
        "response_sha256": {
          "type": "string",
          "pattern": "^[0-9a-f]{64}$"
        }
      }
    },
    "quality": {
      "type": "object",
      "additionalProperties": false,
      "required": [
        "expected_months",
        "valid_months",
        "missing_months",
        "status",
        "warnings"
      ],
      "properties": {
        "expected_months": {
          "type": "integer",
          "minimum": 1
        },
        "valid_months": {
          "type": "integer",
          "minimum": 0
        },
        "missing_months": {
          "type": "integer",
          "minimum": 0
        },
        "status": {
          "enum": [
            "complete",
            "incomplete"
          ]
        },
        "warnings": {
          "const": [
            "POINT_SAMPLE_NOT_REGION_AVERAGE",
            "INFERENCE_NOT_PERFORMED",
            "PROVIDER_PIXEL_QA_NOT_SUPPLIED"
          ]
        }
      }
    },
    "series": {
      "type": "array",
      "minItems": 1,
      "items": {
        "type": "object",
        "additionalProperties": false,
        "required": [
          "date",
          "value",
          "status"
        ],
        "properties": {
          "date": {
            "type": "string",
            "pattern": "^\\d{4}-(0[1-9]|1[0-2])$"
          },
          "value": {
            "type": [
              "number",
              "null"
            ]
          },
          "status": {
            "enum": [
              "valid",
              "not_returned",
              "provider_fill"
            ]
          }
        }
      }
    },
    "module_details": {
      "type": "object",
      "additionalProperties": false,
      "required": [
        "provider_header",
        "provider_parameter",
        "provider_coordinates",
        "provider_annual_summary",
        "provider_messages"
      ],
      "properties": {
        "provider_header": {
          "type": "object"
        },
        "provider_parameter": {
          "type": "object"
        },
        "provider_coordinates": {
          "type": "array",
          "minItems": 2,
          "items": {
            "type": "number"
          }
        },
        "provider_annual_summary": {
          "type": "object",
          "additionalProperties": {
            "type": [
              "number",
              "null"
            ]
          }
        },
        "provider_messages": {
          "type": "array"
        }
      }
    },
    "method": {
      "type": "object",
      "additionalProperties": false,
      "required": [
        "id",
        "version",
        "inference"
      ],
      "properties": {
        "id": {
          "const": "power_t2m_point_normalization"
        },
        "version": {
          "type": "string",
          "pattern": "^\\d+\\.\\d+\\.\\d+$"
        },
        "inference": {
          "const": "not_performed"
        }
      }
    }
  }
}
